Grupo,Frase,Tipo
210,Right engine baffle No. 4 shows a cracked reinforcing brace.,var
210,Cracked reinforcing brace on the left baffle of engine 5.,var
211,The oil sump screen is damaged.,var
211,Found damage to the engines sump screen.,var
211,The sump strainer screen shows signs of damage.,var
211,Inspection revealed a compromised oil sump screen.,var
212,Found a crack in the corner patch of the left rear engine baffle.,var
212,The corner patch on the right aft engine baffle has split and needs attention.,var
212,"Left rear baffle corner patch is cracked, confirmed on inspection.",var
212,Cracked corner patch observed on the right rear engine baffle during the check.,var
213,The alternator belt is loose and needs to be re-tensioned.,var
213,Found the alternator drive belt slack; tighten it before next flight.,var
213,Alternator belt shows excessive looseness on inspection.,var
213,The belt on the alternator has come loose.,var
214,"Propeller RPM climbed to 2730 rpm, I noticed it and reduced power.",var
214,"I saw the prop hit about 2700 rpm, so I backed off and lowered the RPM.",var
214,Prop RPM reached 2720 rpm; observed and reduced it.,var
214,Prop rpm rose to 2750 before I noticed and reduced it.,var
215,"During descent the engine exceeded maximum RPM, rising to about 2,800 rpm.",var
215,"On approach the revs went past the limit and climbed to roughly 2,600 rpm.",var
215,"While descending the prop oversped  RPM spiked up to nearly 2,900.",var
215,"Descend phase exceeded max allowed engine speed, reaching approximately 2.7k rpm.",var
216,"Idle override speed was 1,300 rpm.",var
216,Idle override jumped up to about 1.4k RPM.,var
216,"Idle-override indicated roughly 1,200 rpm.",var
216,"Measured idle override at 1,250 RPM.",var
217,Compression check of the right engines #4 cylinder indicated low compression.,var
217,Found low compression on cylinder 3 of the left engine during the test.,var
217,"Low compression was recorded on the right engine, cylinder 2.",var
217,Cylinder #4 on the left engine showed low compression on the compression test.,var
218,The inner-most baffle seal rivet on the aft baffle of cylinder #3 has been pulled through.  ,var
218,Found the rear baffle inner seal rivet pulled through on cylinder #2.  ,var
218,Inner aft-baffle seal rivet for cyl #4 is pulled through.  ,var
218,The aft baffles innermost seal rivet on cylinder 1 has worked its way through.,var
219,"After performing a simulated engine failure, smoothly applied the throttle to restore power.",var
219,"    Once the simulated engine failure was run, I gently rolled on the throttle to regain thrust.",var
219,    Simulated engine failure completed; power was applied smoothly.,var
219,"    Following the simulated engine failure, smoothly advance the power lever to recover engine output.",var
220,Cylinder #4 compression measured 30/80 during the check.,var
220,Compression on No. 3 cylinder was recorded as 30 out of 80.,var
220,Got a 30/80 compression reading on cylinder four.,var
220,Cyl 5 showed a 30/80 compression reading.,var
221,"During the climb, the aircraft experienced a partial loss of power.",var
221,Noticed a drop in engine power partway up during the climb.,var
221,A partial engine power reduction occurred while climbing.,var
221,Encountered partial loss of thrust during climb.,var
222,Oil seepage was observed on the right side of the engine during inspection.,var
222,Found oil stains along the left side of the engine.,var
222,Evidence of an oil leak was noted on the engines right-hand side.,var
222,Oil residue detected on the engines left flank.,var
223,Left engine left-aft baffle is chafing on the cylinder.,var
223,Right engine rear baffle was rubbing against the cylinder.,var
223,Aft baffle on engine #2 is contacting and abrading the cylinder.,var
223,Found the left aft baffle on engine #1 rubbing the cylinder during inspection.,var
224,The engine baffle snapplug tab has broken off.,var
224,Found the snap plug tab on the engine baffle sheared off.,var
224,One of the engine baffles snapplug tabs was snapped off.,var
224,The engine baffle snap plug is missing its tab after it broke off.,var
225,Engine RPM spiked to about 2750 rpm for roughly 3 seconds.,var
225,The engine reached 2760 RPM for approximately 2 seconds.,var
225,Observed a brief overspeed to around 2800 rpm that lasted about 12 seconds.,var
225,Engine revs climbed to roughly 2700 RPM for a couple of seconds.,var
226,Idle mixture requires adjustment.,var
226,The idle mix needs a little tweaking.,var
226,Adjust the fuel/air mixture at idle.,var
226,Mixture setting at idle is incorrect and should be adjusted.,var
227,Thrust button on the rocker shaft for cylinder #3 of the left engine is worn out.,var
227,The rocker-shaft thrust button on cylinder #2 of the right engine is completely worn.,var
227,"Found a worn thrust button at the rocker shaft, cylinder #4, left engine.",var
227,"Rocker shaft thrust button worn  cylinder #3, right engine.",var
228,Right baffle spark plug access button is worn and requires attention.,var
228,The left baffles spark-plug access button shows wear and should be replaced.,var
228,Inspection found wear on the spark plug access button of the baffle (right side).,var
228,Worn baffle spark plug access button  left side noted.,var
230,The right rear baffle bracket rivet head is missing.,var
230,Noted missing rivet head on the left back baffle bracket during inspection.,var
230,Found the rivet head absent from the rear baffle bracket on the right side.,var
230,Rivet head has come off the left rear baffle bracket.,var
231,Both spark plug baffle plugs are worn.,var
231,    The left and right spark plug baffle plugs show wear.,var
231,    #1 and #2 spark plug baffle plugs exhibit wear.,var
231,    Worn baffle plugs found at both spark plug locations.,var
232,Left baffle requires a patch.,var
232,Patch needed on the #2 baffle (right side).,var
232,LH baffle to be patched at next inspection.,var
232,Right-side baffle (#1) needs a patch.,var
233,The aft alternator mounting bolt is cutting into the scroll mount.,var
233,Found the rear alternator bolt wearing into the scroll mount during inspection.,var
233,The scroll mount has been eaten into by the aft alternator mounting bolt.,var
233,Aft alternator mounting fastener is chewing into the scroll mount and causing damage.,var
234,Excessive end play was observed at the throttle cable attachment.,var
234,There is too much axial movement at the throttle cable connection.,var
234,The throttle cable end is loose with excessive play at the attachment point.,var
234,Excessive longitudinal free-play found at the throttle cable attach fitting.,var
235,Outer baffle tie and spring broken on engines #2 and #4.,var
235,Found the outer baffle tie and spring snapped on engines 1 and 3.,var
235,Left-side baffle outer tie and spring discovered broken.,var
235,Right baffle outer tie and spring fractured on engine 4.,var
236,The inner tie and return spring on the #1 and #3 baffles are out of position.,var
236,Found the left baffles inner tie and spring on engine 4 pushed out of place.,var
236,Baffle inner tie and spring displaced on engines 2 and 4.,var
236,Right baffle inner tie and spring are not seated properly.,var
237,Oil leak detected from the left engine.,var
237,Found oil dripping from the right engine during the walkaround.,var
237,Engine 1 exhibits an oil leak.,var
237,Oil leaking on engine 2.,var
238,The aft copilotside engine baffle support was found loose.,var
238,Found the rear baffle support on the first officers side engine coming loose.,var
238,The aft baffle support on the pilotside engine baffle is loose.,var
238,Rear left engine baffle support loose.,var
239,"After completing steep spirals at power idle, smoothly applied power.",var
239,"    Upon finishing steep-spiral maneuvers at idle power, the throttle was advanced smoothly.",var
239,"    Once the steep spirals at power-idle were done, smoothly increase engine power.",var
239,"    Complete the steep spirals at idle power, then smoothly add power.",var
240,"Right engine, cylinder 3: baffle is loose and rubbing on the oil return line.",var
240,Found the left engines #2 cylinder baffle loose and scraping against the oil return hose.,var
240,A loose baffle at cylinder 4 on the right engine is contacting the oil return line.,var
240,Loose baffle on the left engine (cyl. 1) was observed rubbing the oil return line.,var
241,The engines baffle plugs are worn and should be replaced.,var
241,    Worn baffle plugs were found on the engine during the inspection.,var
241,    Plugs for the engine baffling show noticeable wear.,var
241,    Inspection revealed the engine baffling plugs are worn out.,var
242,The thrust buttons on the left #3 cylinder rocker shaft are deteriorated.,var
242,Found the rocker shaft thrust buttons badly worn on the right #2 cylinder.,var
242,Rocker shaft thrust buttons for cylinder 3 (left) showed signs of deterioration.,var
242,Thrust buttons on the left #4 cylinders rocker shaft have deteriorated.,var
243,A rivet on the engine baffle mount bracket for cylinder #3 has sheared.,var
243,Found the baffle bracket rivet on cylinder #2 sheared off during inspection.,var
243,Mount bracket rivet at the engine baffle for cylinder #4 is sheared.,var
243,Rivet sheared on cylinder #1 engine baffle mount bracket.,var
244,Oil return lines on the right (No. 2) engine are leaking.,var
244,Found oil seeping from the return lines on the left engine.,var
244,Leak detected at the engine oil return lines of No. 1.,var
244,Starboard engine oil return hoses are showing leakage.,var
245,The left button plug shows signs of wear and should be replaced.,var
245,Found the right-side button plug worn out and in need of replacement.,var
245,Left-side button plug worn.,var
245,Button plug on the right-hand side is worn and requires service.,var
246,"During taxi, the engine coughed and sputtered whenever the RPMs dropped.",var
246,"While taxiing, the engine experienced coughing and sputtering anytime RPMs were reduced.",var
246,Engine would cough and sputter on taxi whenever the throttle was backed off and RPMs were low.,var
246,Coughing and sputtering occurred during taxiing any time engine RPM fell.,var
247,The inter-cylinder baffle support rod is fractured and needs replacement.,var
247,Found the support rod that holds the intercylinder baffle snapped.,var
247,Support rod for the intercylinder baffle has failed.,var
247,A break was detected in the baffle support rod between cylinders.,var
248,The oil return line clamps on the right engine are loose.,var
248,Found a loose oil-return clamp on the left engine during the inspection.,var
248,Right engine oil-return tube clamps need tightening  they were observed loose.,var
248,Loose clamps noted on the #2 engine oil return line.,var
249,Wiring holder on cylinder #1 is broken.,var
249,Found the wiring clamp fractured at cylinder #2 during inspection.,var
249,The wiring retainer at cylinder three came apart.,var
249,Cylinder #4 wiring support is damaged.,var
250,A hidden-damage inspection is required following the engine fire.  ,var
250,Perform an inspection for concealed damage due to the engine fire.  ,var
250,Engine fire may have caused hidden damage  an inspection is necessary.  ,var
250,Require hidden damage inspection after the engine fire.,var
251,The #2 intake tube is rubbing against the baffle.,var
251,Found the #4 engine intake tube chafing on the baffle.,var
251,Intake tube on engine #1 is contacting the baffle.,var
251,Engine #3 intake duct is rubbing the baffle and showing wear.,var
252,The engine ground connection is loose.,var
252,Found a loose grounding strap on the engine.,var
252,During inspection the engine ground lead was not tight.,var
252,The engines ground wire came loose.,var
253,Baffle support steel rods for cylinders #2 and #4 are missing.,var
253,Found the steel baffle support rod gone from cyl 4 and cyl 2 during the check.,var
253,Left baffle support rod on cylinder 2 and right support rod on cylinder 4 were not present.,var
253,Cylinders 1 and 3 have missing baffle support steel rods.,var
254,The aft baffle bracket on cylinder #2 was loose and has been secured to engine C.  ,var
254,Found the rear baffle bracket on the #4 cylinder rattling  I fastened the bracket back onto engine C.  ,var
254,A loose aft baffle bracket was noted on left cylinder 1; the bracket was tied down to engine C.  ,var
254,"Cylinder #5 aft baffle bracket was loose, bracket secured to engine C.",var
255,Right engine running rough; it was fine at low altitudes.,var
255,    ,var
255,Left engine felt rough during cruise but worked normally down low.,var
255,    ,var
255,"The #2 engine showed rough operation at higher levels, acceptable at lower altitudes.",var
255,    ,var
255,"Crew reported roughness on the right-hand engine above low altitude, with normal performance when low.",var
256,The thrust plug on the #3 rocker shaft is broken.,var
256,Found the #1 rocker shaft thrust plug sheared off.,var
256,Rocker shaft thrust plug for engine #4 has failed  it's broken.,var
256,A broken thrust plug was discovered on the #2 rocker shaft.,var
257,Leak detected at the intake tube flange of cylinder 3  fuel seeping at the connection between the tube and the flange.,var
257,Fuels coming out of the intake tube flange on cylinder 2; the joint where the tube meets the flange isnt sealing.,var
257,Cylinder 4 intake tube flange leaking fuel at the tube-to-flange connection.,var
257,Intake tube flange on cylinder 5 is leaking fuel at the tube connection.,var
258,The #1 cylinder standoff is broken.,var
258,Found a broken standoff on cylinder #2 during inspection.,var
258,Cylinder 3s standoff has failed and is damaged.,var
258,The standoff for the #4 cylinder is fractured.,var
259,Crack observed at the baffle corner adjacent to cylinder #4.,var
259,Found a cracked baffle corner next to cylinder #3 during the inspection.,var
259,The baffle corner beside cylinder 5 is fractured.,var
259,Corner of the baffle by cylinder #2 shows a crack.,var
260,Engine overspeed recorded at 3300 RPM.,var
260,"The engine spooled up to 3400 rpm, exceeding the limit.",var
260,An overspeed event was observed with the engine reaching about 3200 revs per minute.,var
260,"Engine exceeded normal speed, peaking near 3330 RPM.",var
261,The right rear baffle rivet head is sheared.,var
261,Found the left back baffle rivet with its head sheared off.,var
261,Rivet head on the #2 rear baffle fractured and is missing.,var
261,Sheared rivet head observed on the right back baffle.,var
262,Left carburetor heat bracket is loose.,var
262,Found the carb heat bracket loose on the right side.,var
262,"Loose carburetor heat bracket noted on L/H unit, No. 1.",var
262,Tighten the loose carburetor heat bracket on No. 2.,var
263,The induction air filter can be replaced during the next inspection.,var
263,You can swap out the intake air filter for a new one.,var
263,Replacement of the induction inlet filter is possible.,var
263,The inlet air filter on the induction system may be changed.,var
264,Both lower deflectors  left and right  have visible cracks.,var
264,Found cracks in the two lower deflectors; both sides are affected.,var
264,Left lower deflector cracked and right lower deflector cracked.,var
264,Two lower deflectors show cracking.,var
265,The forward left baffle anti-chafe strip fell off.,var
265,The front right baffle anti-wear strip has detached.,var
265,Found the forward LH baffle chafe strip missing  it came off.,var
265,The anti-chafe strip on the forward left baffle is gone; it separated.,var
266,"Aft engine baffle by cylinder #2, support secured to engine case.",var
266,The rear baffle next to cylinder 4 had its support fastened to the engine case.,var
266,Support for the aft baffle adjacent to cylinder #3 was secured to the engine case.,var
266,Rear baffle at cylinder #1  support attached to the engine case.,var
267,The rear right engine baffle bracket was found cracked during inspection.,var
267,Found a crack in the engines rear left baffle bracket.,var
267,Crack observed in No. 3 engine aft baffle bracket.,var
267,Rear RH engine baffle bracket shows a fracture.,var
268,Engine exhibits rough running at idle RPM.,var
268,At idle speed the engine is coughing and running unevenly.,var
268,Roughness was noted when the engine was at idle.,var
268,When idling the engine does not run smoothly.,var
269,The impeller is rubbing against the scroll housing.,var
269,Contact was observed between the compressor wheel and the scroll (volute).,var
269,The rotor blade tips are making contact with the scroll.,var
269,Found the impeller touching the scrollclearance is insufficient.,var
270,During climb-out the engine lost approximately 250 RPM.,var
270,On the climb out the engine dropped about 300 rpm.,var
270,Engine suffered a roughly 200 RPM decrease after liftoff.,var
270,During climb-out the engine fell off around 240 rpm.,var
271,"Engine override speed was 1,225 RPM.",var
271,"    The engine over-ride point was recorded at 1,230 rpm.",var
271,"    Measured engine override speed: 1,220 revolutions per minute.",var
271,"    Engine overspeed threshold registered about 1,240 rpm.",var
272,External gasket on cylinder #3 is about half gone.,var
272,About 50% of the outer gasket on cylinder 2 has worn away.,var
272,Half of the external gasket on cyl #4 is missing.,var
272,Found the cylinder three external gasket roughly half deteriorated.,var
273,The lacing cord on the oil cooler lines is coming apart.,var
273,Found the oil-cooler lines lacing cord frayed and falling apart.,var
273,The cord securing the oil cooler lines has deteriorated and is separating.,var
273,The lacing cord that ties the oil cooler lines is falling apart and needs attention.,var
274,Right engine cylinder No.4 aft baffle wire-harness tab is cracked.,var
274,Found a cracked aft-baffle wire harness tab on the left engines #3 cylinder.,var
274,The aft baffle wire-harness tab for cylinder 5 of the right engine has a crack.,var
274,"A crack was noted in the aft baffle wire-harness tab on the left engine, cylinder 4.",var
275,Inspection indicates the exhaust valve pushrod tube on cylinder #2 appears to be leaking.,var
275,Looks like the pushrod tube for the exhaust valve on cylinder 4 is seeping.,var
275,A leak was detected at the exhaust-valve push rod tube of cylinder #1.,var
275,The push rod tube for the exhaust valve on cylinder #3 seems to be leaking.,var
276,Lower intake clamps on cylinder No.1 are loose.,var
276,    The lower intake clamps at cylinder #2 were found loose during inspection.,var
276,    Found loose lower intake clamps on cylinder 3  tighten before next flight.,var
276,    The lower intake clamps on the left cylinder are loose and need to be secured.,var
277,Crack in the aft engine baffle at the oil cooler on the right engine.,var
277,Found a split in the rear baffle by the oil cooler on the left engine.,var
277,Aft baffle fractured at the oil cooler on #2 engine.,var
277,Detected a crack in the rear baffle at the oil cooler of the #1 engine.,var
278,The idle-override setting is reading low.,var
278,The idle override is turned down too low.,var
278,Idle override level low on inspection.,var
278,Found the idle override position low.,var
279,The spark plug access hole in the baffle for cylinder #3 is elongated.,var
279,Found the spark plug access opening on the left baffle at cylinder 2; its worn oversize.,var
279,Access hole for the spark plug on baffle cylinder 5 is elongated.,var
279,Cylinder #4 baffle spark plug access hole elongated.,var
280,The front rubber baffle on the right side of the engine tore away from its mounting.,var
280,"On the #2 engine, the front rubber baffle on the left side ripped off the mount.",var
280,Front rubber baffle  engine right side  separated from mounting during inspection.,var
280,The #1 engines forward rubber baffle was found ripped from its right-hand mounting.,var
281,The aft nut on the inner-cylinder baffle tie rod for the left engines cylinders 1 and 3 is magnetic.,var
281,Found the inner baffle tierod aft nut on the right engine (cylinders 2 and 4) showing magnetic attraction.,var
281,"Inner cylinder baffle tie rod aft nut, left side affecting cylinders #2 and #4, tested magnetic.",var
281,The aft nut on the inner-baffle tie rod for the right engines cylinders 1 and 3 is magnetic.,var
282,Cylinder 3 intake pipe needs to be re-wedged into the sump.,var
282,The intake tube on cylinder #2 has come loose and must be reseated into the oil sump.,var
282,Intake pipe for cylinder No.4 requires re-wedging into the sump.,var
282,Re-wedge the intake pipe of cylinder three back into the sump.,var
283,The forward lower baffle on engine #2 has a crack.,var
283,Found a crack in the forward lower baffle of engine 3.,var
283,Forward lower baffle on engine 1 is cracked.,var
283,Inspection revealed a fracture in the forward lower baffle of engine #2.,var
284,Left inter-cylinder baffle is loose.,var
284,The inter-cylinder baffle on the right side is loose.,var
284,Found a loose No. 1 inter-cylinder baffle during inspection.,var
284,Inter-cylinder baffle at left bank not secured  its loose.,var
285,A wire on the left side of the engine baffle was found loose.,var
285,Found a loose wire on the right-hand baffle of the engine.,var
285,Left-side baffle wire on engine #1 is loose and needs securing.,var
285,The engine baffles right side wire is loose.,var
286,The forward baffle is chafing against the muffler shroud and showing abrasion.,var
286,    Found the front baffle rubbing on the muffler shroud  it's causing wear.,var
286,    Observed contact between the forward baffle and muffler shroud with chafing present.,var
286,    Chafing of the muffler shroud by the forward baffle was detected during inspection.,var
287,Right engine baffle tie-rod spacers at positions 1 and 3 are loose.,var
287,Found loose baffle tie rod spacers on the left engine at stations 2 and 4.,var
287,Baffle tie-rod spacer for the right engine (Nos. 1 & 3) was checked and is loose.,var
287,"Observed loose tie-rod spacers on the engine baffle, left side, unit numbers 3 and 1.",var
288,The rubber insert on the Adel clamp for the left engine sniffler valve hose is worn out.,var
288,Found the Adel clamp rubber on the right engines sniffler valve hose badly worn.,var
288,Adel clamp rubber at the left engine sniffler valve hose shows significant wear.,var
288,The Adel-clamp rubber on #2 engine sniffler valve hose is worn and needs replacement.,var
289,"Immediately after engine start, a high-pitched whine/squeal was heard.",var
289,"Right after starting the engine, crew noticed a sharp high-frequency squeal.",var
289,"Upon engine start-up, a loud, high-pitched whine/whistle occurred.",var
289,"Shortly after the engine started there was a shrill, high-pitched whine.",var
290,The rivet on the right rear baffle bracket has sheared off.,var
290,Found a sheared rivet on the left back baffle bracket.,var
290,Rivet #1 on the right aft baffle bracket is sheared.,var
290,Aft baffle bracket rivet on the left side sheared away.,var
291,The Adel clamp was torn by the right engine mount.,var
291,Found the Adel clamp ripped against the left engine mount.,var
291,Adel clamp at engine mount #2 showed tearing from contact with the mount.,var
291,Torn Adel clamp located on #1 engine mounting area.,var
292,A rivnut on the firewall that secures the A/F fuel filter has stripped out and lost its threads.,var
292,The nutsert holding the A/F fuel filter to the firewall has spun out and come loose.,var
292,Rivnut stripped from firewall at the A/F fuel filter attachment.,var
292,Replace the stripped rivet nut on the firewall for the A/F fuel filterthe mount is no longer secure.,var
293,Left engine N1 RPM shows an uncommanded increase of 34% while the engine is running.,var
293,The right engines N1 unexpectedly jumps about 2 to 5% when the engine spools up.,var
293,An uncommanded 4% rise in N1 RPM was observed on the left engine.,var
293,N1 on the left engine climbs an unexpected 3% to 4% whenever the engine is operating.,var
294,Tabs on the baffle plugs are broken off on both the left and right sides.,var
294,Baffle plug tabs have sheared off on the right and left sides.,var
294,Found the baffle plug tabs busted off on both sides  left & right.,var
294,Tabs on the #1 and #2 baffle plugs were found broken off.,var
295,During the prior shutdown the engine quit when the throttle was closed.,var
295,The engine stopped as the throttle was shut during the earlier shutdown.,var
295,"While closing the throttle on the previous shutdown, the engine unexpectedly quit.",var
295,Engine quit upon throttle closure during the prior shutdown procedure.,var
296,The left engines left baffle tie rod pulled through the baffle.  ,var
296,Left baffle tie-rod on engine #1 came through the baffle during inspection.  ,var
296,"On the right engine, the left baffle tie rod tore through the baffle.  ",var
296,Engine #2 shows the left baffle tie rod protruding through the baffle.,var
297,The rigid drain line from the right-engine burner can is contacting the bottom cutoff.,var
297,On the left engine the burner-can drain hard line is touching the lower cutoff.,var
297,Found the burner can drain rigid tube on #2 engine making contact with the bottom cutoff.,var
297,Right-side burner-can drain has its rigid line rubbing against the bottom cutoff.,var
298,Shortly after takeoff the engine RPMs fluctuated and the engine began to run rough.,var
298,    After liftoff the tachometer fluttered and the engine went rough.,var
298,    During initial climb the RPM was unstable and the engine started running roughly.,var
298,    On climb-out the RPMs were bouncing and the engine began to misfire and run rough.,var
299,An oil leak was observed on the forward section of the engine.,var
299,Found oil leaking from the front part of the engine.,var
