Grupo,Frase,Tipo
1067,Clip for the oil baffle cooler bracket shows signs of wear.,var
1068,The engine-to-baffle attach fitting is missing a screw.,var
1068,The fitting that secures the baffle to the engine has a screw gone.,var
1068,Found a missing screw in the attachment fitting between the engine and baffle.,var
1068,A screw is absent from the fitting that attaches the baffle to the engine.,var
1069,"The engine grounding wire had paint under the lug and the securing bolt was loose, preventing a solid electrical contact.",var
1069,Found paint left on the ground wire contact to the engine and the bolt was loose.,var
1069,Paint was not removed from under the engine ground termination and the retaining bolt was loose.,var
1069,The ground wire to the engine had paint on the contact area and its bolt was loose.,var
1070,The forward engine's black baffle seal shows a small worn spot on the left side.,var
1070,"Found a tiny rubbed area on the black baffle seal of the #1 forward engine, on the right side.",var
1070,A small abrasion was noted on the LH side of the black baffle seal for the forward engine.,var
1070,Forward engine No.2 black baffle seal has a minor wear spot on the right side.,var
1071,The black forward seal shows localized wear spots.,var
1071,    The forward black seal has several worn patches.,var
1071,    Found worn areas on the black seal at the forward position.,var
1071,    The black seal up front has abrasion marks in a few places.,var
1072,"Engine speed held at 2,700 RPM for 2 seconds.",var
1072,RPM spiked to 2.7k and stayed there for about two seconds.,var
1072,"Engine reached roughly 2,800 rpm and remained for 3 sec.",var
1072,"Rotational speed was 2,600 RPM for one second.",var
1073,"During an unusual attitude recovery, power was added and engine speed rose to approximately 280 rpm.",var
1073,While in the odd attitude I advanced the throttle and the engine climbed to about 290 rpm.,var
1073,Power was applied in the unusual attitude and the engine reached roughly 275 rpm.,var
1073,Throttle was increased during the unusual attitude and the engine went up to around 300 rpm.,var
1074,The rivet head on the alternator air door sheared off.,var
1074,A rivet head securing the alternator air door has sheared.,var
1074,Found a sheared rivet head at the alternator air door.,var
1074,One of the rivet heads on the alternator air door is sheared.,var
1075,The forward sniffler valve is leaking oil and fuel; an approximately 6inch puddle was observed beneath it.,var
1075,"Oil and fuel are dripping from the front sniffer valve  theres about a 4"" puddle on the deck.",var
1075,Forward sniffer valve found leaking fuel/oil; puddle roughly 8 inches in diameter under the valve.,var
1075,Found oil/fuel seeping from the forward sniffler valve with a wet spot of about 15 cm beneath it.,var
1076,An oil leak was found on the #2 cylinder during inspection.,var
1076,During the check we noticed oil seeping from the No. 3 cylinder.,var
1076,Oil was discovered leaking from cylinder number 1.,var
1076,Found an oil leak on the #4 cylinder.,var
1077,An oil leak was detected on the right forward cylinder intake tube.,var
1077,Found oil dripping from the intake tube of the left front cylinder.,var
1077,Oil observed leaking at the forward-cylinder intake pipe on the right side.,var
1077,Leak at the intake tube of the front (Cyl 1) cylinder  oil present on the left forward intake tube.,var
1078,"Cylinder head temperatures are high, exceeding 420F.",var
1078,Cyl heads were running over 390F during the run.,var
1078,High cylinder head temps recorded  above 400F.,var
1078,Observed cylinder head temperatures reaching approximately 410F.,var
1079,Oil is leaking from the top of the left cowling.,var
1079,Oil is coming out of the upper right cowling.,var
1079,"During inspection, oil was found exiting the top-left cowl.",var
1079,There's oil dripping from the top of the right-hand cowling.,var
1080,Right engine over-temperature recorded at 503F.,var
1080,"The left engine exceeded temperature limits, reaching about 495F.",var
1080,Right engine overheated  temperature logged at 508 degrees.,var
1080,"Left engine high-temp condition, approximately 500F.",var
1081,"A prop strike occurred and the propeller is damaged beyond repair, requiring replacement.",var
1081,The prop hit something and needs to be replaced.,var
1081,Propeller impact detected  replacement of the prop is required.,var
1081,Prop struck an object; replace the propeller.,var
1082,Propeller oversped in a downdraft to about 2730 RPM for roughly 23 seconds.,var
1082,Hit a downdraft and the prop jumped up to roughly 2800 rpm for a couple of seconds.,var
1082,"During the downdraft the prop went to about 2700 RPM, lasting approximately 34 seconds.",var
1082,Prop overspeed in a downdraft  climbed to ~2750 rpm for around 12 sec.,var
1083,The engine grounding bolt was found loose during inspection.,var
1083,Found the grounding bolt on the engine loose  needs tightening.,var
1083,Loose engine ground bolt identified.,var
1083,The bolt securing the engine grounding strap is loose and requires retorquing.,var
1084,All hose clamps on the rocker drain hoses are loose.,var
1084,Found every clamp on the rocker drains loose during the inspection.,var
1084,Every hose clamp securing the rocker drains is not tight.,var
1084,All clamps holding the rocker box drain hoses have come loose.,var
1085,The standoff on cylinder #3 is broken.,var
1085,Found the standoff on cylinder #2 busted during inspection.,var
1085,Cylinder #4 standoff has fractured.,var
1085,Inspection revealed a broken standoff at cylinder #1.,var
1086,The black forward engine seal is worn in spots and loose on the left side.,var
1086,Found the forward black seal on the engine with spotty wear; it's loose over on the right side.,var
1086,Forward black seal shows localized wear and is loose at the port side.,var
1086,The engines forward black seal has worn areas and is loose along the left flange.,var
1087,During flight the left engine was running rough and could not be stabilized.,var
1087,The right engine was running rough in the air and we couldn't get it to smooth out.,var
1087,"In-flight, #1 engine showed rough operation; attempts to correct it were unsuccessful.",var
1087,Left engine rough during flight  could not restore normal power.,var
1088,During the run-up I pulled the throttle back to idle and the engine shut down.,var
1088,"While performing the run-up, the throttle was reduced to idle and the engine stopped.",var
1088,Throttle retarded to idle during run-up; engine quit.,var
1088,"During the run-up sequence, closing the throttle to idle caused the engine to shut down.",var
1089,"Engine was sputtering and looked like it was going to cut out at 1,000 RPM.",var
1089,The engine started coughing like it might quit around 1k rpm.,var
1089,At about 900 RPM the engine sputtered as if it were going to shut down.,var
1089,"Observed engine sputter near 1,100 r/min, indicating an imminent cut-out.",var
1090,Stuck valve on cylinder No. 3; pushrod and housing are damaged.,var
1090,Found a seized valve at cylinder #2  push rod and housing show damage.,var
1090,Valve stuck on cylinder 4 with associated damage to the pushrod and its housing.,var
1090,Cylinder #3 has a stuck valve; push-rod and housing are damaged and need repair.,var
1091,The upper leads on #2 and #4 must be secured at the battery cooling assembly.,var
1091,Secure the top leads for engines 1 and 3 at the battery cooling area.,var
1091,Anchor the upper battery-cooling leads for 4 and 2 so they dont move.,var
1091,Tie down the left upper leads at the battery cooling shroud; they need to be fastened.,var
1092,The #2 baffle requires patching and the button-plug hole shows excessive wear.,var
1092,"Found the #4 baffle needs a patch, and the button plug hole is worn out too.",var
1092,Baffle on #3 needs patching; button plug hole also worn.,var
1092,Patch the #1 baffle  the button plug hole has worn as well.,var
1093,Propeller oversped to 2720 RPM for approximately 1 second.,var
1093,The prop briefly jumped up to about 2750 rpm and stayed there for roughly one second.,var
1093,An overspeed event was recorded with the prop reaching around 2700 RPM for nearly 1 s.,var
1093,Observed prop peak at 2725 rpm lasting approximately one second.,var
1094,The baffle on cylinder No. 1 is not secured.,var
1094,Found the #2 cylinder baffle loose during the inspection.,var
1094,Left-side cylinder baffle (cyl. 3) is unfastened.,var
1094,Cyl. 4 baffle unsecured.,var
1095,Engine ran rough on start-up.,var
1095,"At engine start, rough running and intermittent misfires were observed.",var
1095,"When started, the engine sputtered and ran unevenly.",var
1095,Rough operation noted during the initial engine run.,var
1096,Impeller contamination was observed.,var
1096,The impeller is filthy and needs cleaning.,var
1096,Found debris and grime on the impeller during inspection.,var
1096,Impeller shows signs of dirt buildup and should be cleaned.,var
1097,Propeller overspeed recorded at 2720 RPM for 6 seconds.,var
1097,The prop was overrevved to about 2700 rpm and stayed there for roughly 5 seconds.,var
1097,We hit a prop overspeed  it peaked near 2725 rpm for about 8 seconds.,var
1097,Prop spooled past the limit to roughly 2720 rpm for six seconds.,var
1098,Right-side oil return lines for #1 and #3 were found loose.,var
1098,Left #2 and #4 oil return lines are not secured.,var
1098,"The oil return tubes on the right, positions 1 and 3, have come loose.",var
1098,Found loose oil return lines on the left for engines 1 and 2.,var
1099,"Upon engine start-up, the throttle was advanced to 1200 RPM toward the leading-edge position.",var
1099,"When starting the engine, I increased the throttle to about 1,100 RPM up to the leading edge.",var
1099,"At engine start, the throttle was moved to 1,250 RPM in the direction of the leading edge.",var
1099,"During start-up, the throttle was opened to roughly 1,300 RPM toward the leading-edge.",var
1100,Forward baffling located aft of the alternator was found cracked.,var
1100,    A crack was observed in the forward baffle immediately behind the alternator.,var
1100,    The forward baffles just aft of the alternator show a crack.,var
1100,    Found cracking in the forward baffle area aft of the alternator.,var
1101,The right baffle spring has pulled through the aft baffling and is protruding rearward.,var
1101,    ,var
1101,Found the left baffle spring pushed through the aft bafflespring came out the back.,var
1101,    ,var
1101,Right-side baffle spring pulled through the aft baffling and is out of position.,var
1101,    ,var
1101,"Aft baffling was pierced by the baffle spring on the left, which pulled through and is not seated.",var
1102,"Left engine runs at 2,700 RPM while the right engine only reaches 2,600 RPM.",var
1102,Right engine is around 2.6k RPM and the left turns about 2.7k.,var
1102,L engine 2700 rpm; R engine 2600 rpm.,var
1102,"Right engine operating at 2,700 rpm, left only at 2,600 rpm.",var
1103,During climb-out there was an audible RPM drop and the engine lost about 450 RPM.,var
1103,    While climbing out I heard the engine sag and the RPM fell roughly 350 rpm.,var
1103,    On climb out an audible reduction in RPM occurred with an approximate 400 rpm loss on the engine.,var
1103,    Climb-out produced a noticeable RPM drop  engine lost around 375 RPM.,var
1104,Engine experienced very rough operation intermittently in the traffic pattern with RPM fluctuations.,var
1104,    The engine ran really rough a couple of times while in the pattern and the RPM was hunting.,var
1104,    Observed rough running on the engine three separate times during the pattern; RPM varied each time.,var
1104,    Engine went rough several times in the pattern and the RPM dropped and rose.,var
1105,The oil breather is leaking.,var
1105,A leak was identified at the crankcase breather vent.,var
1105,Oil is seeping from the breather tube.,var
1105,Leak detected from the breather assembly  service required.,var
1106,Propeller oversped to 2630 RPM during the event.  ,var
1106,The prop went past the limit and climbed to about 2600 rpm.  ,var
1106,A prop overspeed was recorded up to 2650 RPM.  ,var
1106,Prop overspeed reached roughly 2635 rpm.,var
1107,The weather stripping on the oil cooler is loose and needs securing.,var
1107,    The oil coolers weatherstrip is coming loose.,var
1107,    Found loose sealing strip around the oil cooler during inspection.,var
1107,    Oil cooler weather sealing has become detached and requires attention.,var
1108,"After engine start the engine ran rough below 1,000 RPM.",var
1108,"Right after starting, the engine was running rough when revs fell under 950 rpm.",var
1108,"Following start, the engine showed rough operation at speeds below about 900 rpm.",var
1108,"Engine started but was rough at low power  under roughly 1,050 RPM.",var
1109,The front lower baffle has a hole worn through by the muffler shroud.,var
1109,Found a perforation in the lower-front baffle where the muffler shroud rubbed it.,var
1109,The forward lower baffle is punctured  the muffler shroud caused the hole.,var
1109,Theres a hole in the lower front baffle from contact with the muffler shroud.,var
1110,The forward baffle seal at the muffler intake is missing.,var
1110,Found the seal on the muffler intake of the forward baffle has come off.,var
1110,Missing forward baffle seal from the muffler inlet on the baffle.,var
1110,The seal for the muffler intake on the forward baffle was not found.,var
1111,The right engine's right baffle tie rod requires adjustment.,var
1111,Adjust the baffle tie rod on the left engine's right side  it's out of alignment.,var
1111,Engine #2 right-side baffle tie rod needs adjustment.,var
1111,"Right engine, baffle tie-rod on #1 requires setting.",var
1112,"Engine RPM would not stabilize, constantly varying and causing a noticeable stutter.",var
1112,Couldn't get a steady RPM  the engine kept fluctuating and was choppy.,var
1112,Observed continuous RPM fluctuations with intermittent engine stutter; RPM failed to settle.,var
1112,"Engine speed failed to hold steady, varying continuously and producing a rough stumble.",var
1113,Throughout the entire flight the left RPM increased significantly.,var
1113,During the whole flight the right engine RPM kept climbing noticeably.,var
1113,For the duration of the flight the left engine's RPM would rise a lot.,var
1113,During the entire flight #1 (left) RPM rose significantly.,var
1114,The engine air filter is dirty and requires cleaning.,var
1114,Found the engine intake filter fouled with dirt.,var
1114,The engine's air filter is clogged and needs service.,var
1114,Air filter on the engine is heavily soiled.,var
1115,Oil pressure sender ground strap is not connected.,var
1115,The ground strap for the oil pressure sensor wasn't hooked up.,var
1115,Grounding lead to the oil pressure sender is disconnected.,var
1115,Found the oil pressure senders ground strap unconnected during inspection.,var
1116,The baffle retaining wire is broken.,var
1116,The baffle wire snapped.,var
1116,Inspection revealed a broken baffle wire.,var
1116,A fracture was noted in the baffle securing wire.,var
1117,"The bracket supporting the baffle, located behind the oil tube, was found cracked.",var
1117,Found a crack in the baffle bracket behind the oil tube.,var
1117,Crack detected in the baffle mounting bracket positioned aft of the oil tube.,var
1117,The baffles bracket behind the oil tube is cracked.,var
1118,During climb-out the engine exhibited rough running and intermittent sputtering was noted.,var
1118,On climb-out the engine began running rough and it was also sputtering.,var
1118,Engine ran rough during climb-out; sputtering was observed.,var
1118,"While climbing out, rough engine performance with accompanying sputtering was recorded.",var
1119,Left engine No. 4 cylinder baffle wire standoff is broken.,var
1119,Found the baffle wire standoff cracked on the right engines #3 cylinder.,var
1119,Baffle wire support on the left engine cylinder 5 has failed.,var
1119,No. 4 cylinder baffle wire standoff on the right engine is fractured.,var
1120,The #1 cylinder baffle seal on the left engine needs to be replaced.,var
1120,Replace the #2 cylinder baffle seal on the right engine.,var
1120,"Left engine, cylinder 3 baffle seal requires replacement.",var
1120,Need to install a new baffle seal on the right engines #1 cylinder.,var
1121,The cowl seal on the lower right engine is missing or loose.,var
1121,Found the lower left engine cowl seal either loose or completely gone.,var
1121,Cowl seal on the lower #2 engine not securedeither absent or loose.,var
1121,Lower #3 engine cowl sealing material is missing/loose at the lower cowling.,var
1122,The carburetor heat box arm on the right engine is loose.,var
1122,Found the carb heat-box arm loose on the left engine during the walkthrough.,var
1122,Loose actuator arm on the #2 engine carburetor heat box was noted.,var
1122,Right-side carburetor heat box linkage is not secure.,var
1123,Carburetor inlet gaskets are leaking on both engines.,var
1123,Both engines have leaks at the carburetor inlet gaskets.,var
1123,Leak detected at the carb inlet gaskets of each engine.,var
1123,The inlet gaskets on the carburetors for both powerplants are leaking.,var
1124,The left inner engine baffle tie is disconnected.,var
1124,    The inboard baffle tie on the right engine has come loose and is disconnected.,var
1124,    Inspection revealed the inner baffle tie disconnected on #2 engine.,var
1124,    Inner engine baffle tie on the left side is not secured.,var
1125,"Engine ran rough after start-up, showing RPM gains and drops of about 8 rpm.",var
1125,"After starting, the engine was coughing and bounced around by roughly 10 revs.",var
1125,"Following start-up the engine operated roughly, with fluctuations of about 6 rpm.",var
1125,Engine rough on start; RPM oscillated around 9 rpm.,var
1126,Engine idle speed is too low.,var
1126,It idles lower than it should.,var
1126,Idle RPM is below the specified limit.,var
1126,Observed a low-idle condition.,var
1127,During the postflight inspection oil was found on the intake pipes.,var
1127,After landing I noticed oil on the engine intake pipes.,var
1127,Postflight check revealed oil contamination on the intake tubing.,var
1127,Found oil coating the intake pipes during the walkaround.,var
1128,Engine exhibited roughness during takeoff.,var
1128,The engine was coughing and rough on takeoff.,var
1128,Rough engine noted at takeoff.,var
1128,Pilot reported the engine running rough during takeoff.,var
1129,Engine idle speed is 1650 RPM.,var
1129,Engine idle reads 1700 rpm on the tach.,var
1129,Set engine idle to about 1600 revolutions per minute.,var
1129,Recorded engine idle at 1655 RPM during the run.,var
1130,The right air intake hose is not hooked up to the intake duct.,var
1130,Found the left air intake hose disconnected and not attached.,var
1130,The right inlet hose was not secured  its not connected.,var
1130,"Left air intake hose hanging loose, not hooked up.",var
1131,Left aft standoff fractured; replacement required.,var
1131,The rear right standoff is busted and needs to be replaced.,var
1131,Aft standoff on the left side found broken.,var
1131,#2 aft standoff cracked and scheduled for replacement.,var
1132,The inner baffle tie was found disconnected.,var
1132,    The inner baffle tie came loose and separated from its attachment.,var
1132,    Inspection revealed the inner baffle tie had become detached.,var
1132,    Found the inner baffle tie not secured  it had disconnected.,var
1133,The right aft baffle bracket has broken rivets and requires repair.,var
1133,Found fractured rivets on the left aft baffle bracket during inspection.,var
1133,Broken rivets were observed on the aft baffle bracket on the right side.,var
1133,Aft baffle bracket (left side) shows failed rivets.,var
1134,After start-up the engine died.,var
1134,The engine quit right after it was started.,var
1134,The engine stalled shortly after being started.,var
1134,Following engine start the engine stopped running.,var
1135,Increasing the throttle caused the engine to sputter and the RPM to drop.,var
1135,Whenever the throttle was advanced the engine would cough and the RPM fell.,var
1135,Any throttle increase produced a momentary sputter with a loss of RPM.,var
1135,Opening the throttle resulted in sputtering and a reduction in engine RPM.,var
1136,A run is required after storage.,var
1136,    Post-storage engine run-up needed.,var
1136,    Need to perform a run after the aircraft has been in storage.,var
1136,"    After long-term storage, conduct a ground run.",var
1137,The baffle tie rod between cylinders #1 and #3 is not hooked up.,var
1137,Found the baffle tie rod between cyls #1 and #2 unhooked.,var
1137,The tie rod for the baffle located between cylinders 2 and 3 was not connected.,var
1137,Baffle tie-rod between cyl #3 & #1 left unhooked.,var
1138,#2 cylinder valve is sticking.,var
1138,    Found the valve on cylinder 3 sticking during the inspection.,var
1138,    Cylinder 1 has a sticking valve  needs correction.,var
1138,"    Left-side cylinder valve intermittently sticking, requires attention.",var
1139,"During climb-out the left engine shuttered three times, and each occurrence showed the same pattern.",var
1139,"While climbing out the right engine hiccuped twice, every time with the same characteristics.",var
1139,On climb-out the port engine shuttered four times; each event matched the same pattern.,var
1139,"During the climb the starboard engine experienced three shuttering events, and it behaved identically each time.",var
1140,"During climb, heard unusual engine noiseengine gave a distinct thump.",var
1140,"    While climbing, the engine made a noticeable thud and sounded noisy.",var
1140,"    Climb out produced an extra engine noise, like a hard knock or ""thu.""",var
1140,"    On the climb, the engine gave a loud clunk and was making more noise than normal.",var
1141,"After the engine and rotor run-up, RPM fell about 250 and continued to drop.",var
1141,Right after the engine/rotor run-up the RPM dropped roughly 200 and kept decreasing.,var
1141,"Following the engine and rotor run-up, rotor RPM decreased by 300 and continued to decline.",var
1141,"Once the run-up was completed, RPM dropped 250 and kept falling.",var
1142,The black forward-lower engine seal exhibits wear at the air intake filter.,var
1142,Found wear on the black forward lower seal of the engine at the air intake filter.,var
1142,Wear observed on the black forward lower engine seal adjacent to the air intake filter.,var
1142,Black forward lower engine seal worn at the engines air intake filter.,var
1143,"During flight elevated oil PSI was recorded, and exercising the propeller caused the oil pressure to increase.",var
1143,    In flight we had high oil psi  when the prop was exercised the oil pressure jumped up.,var
1143,    High oil pressure occurred during the flight; oil PSI rose when the prop was exercised.,var
1143,"    Noted high oil PSI while airborne, with oil pressure increasing during prop exercise.",var
1144,The baffle seal on the right engines #1 side is worn.,var
1144,Found the #1-side baffle seal on the left engine worn during inspection.,var
1144,Worn baffle seal at side 1 of the right engine  recommend replacement.,var
1144,Baffle seal on the right engines #2 side shows wear and needs service.,var
1145,The alternate air door spring exhibits insufficient tension.,var
1145,The spring on the alternate air door is weak and barely holds the door closed.,var
1145,Found a weak alternate-air-door spring during the inspection.,var
1145,Alternate air door spring needs replacement because it has lost its spring force.,var
1146,Cylinder 3 shows low compression (40/80) with air leaking from the exhaust.,var
1146,    ,var
1146,Only 40 of 80 on cylinder 2  you can hear air blowing out the exhaust.,var
1146,    ,var
1146,Low compression noted (45/80) on #4 cylinder; leak found at the exhaust port.,var
1146,    ,var
1146,"Compression low on cylinder 1 (40/80), exhaust leak present.",var
1147,"During flight the engine indicated 2,740 rpm for 3 seconds.",var
1147,"While airborne the engine spiked to about 2,745 rpm and held that for roughly three seconds.",var
1147,"In flight the engine ran at approximately 2,735 rpm for 23 seconds.",var
1147,Engine RPM reached 2740 rpm for three seconds during the flight.,var
1148,A large pool of oil was found under the engine; oil has been added over the last 2 days.  ,var
1148,Theres a big puddle of oil beneath the engine and Ive been topping it up the past 3 days.  ,var
1148,Significant oil accumulation under the engine  oil was replenished within the past 48 hours.  ,var
1148,Large oil leak observed under engine; oil has been added during the past couple of days.,var
1149,Intake tube inserts in the sump for cylinders 2 and 3 are loose.,var
1149,    The sump intake-tube inserts came loose on the right-side cylinders 3 and 4.,var
1149,    Found loose intake tube inserts in the sump at cylinders 4 and 5.,var
1149,    Left-side cylinder intake tube inserts in the sump (cylinders 1 and 2) are loose.,var
1150,Engine reached 2720 RPM for about 2 seconds.,var
1150,Spiked to roughly 2700 rpm for a couple of seconds.,var
1150,Observed 2725 RPM held for approximately 2.0 s.,var
1150,RPM climbed to about 2710 for ~2 seconds.,var
1151,"Immediately after engine start, noticeable vibration occurred and a cylinder is suspected.",var
1151,    ,var
1151,When the engine was started it started shaking  likely a cylinder problem.,var
1151,    ,var
1151,On start-up the engine exhibited vibration; probable cylinder malfunction suspected.,var
1151,    ,var
1151,"After cranking the engine, vibration was felt; suspect one of the cylinders.",var
