Grupo,Frase,Tipo
640,Small nick found in a 3rd-stage compressor blade.,var
641,Both left and right baffle plugs are missing their tabs.,var
641,The RH and LH baffle plugs don't have tabs  they're missing on both sides.,var
641,Found missing tabs on the right and left baffle plugs.,var
641,Baffle plugs #1 and #2 were reported without tabs.,var
642,Are the aluminum fittings on the oil cooler OK?,var
642,Please confirm the oil coolers alum fittings are serviceable.,var
642,Can you check if the oil cooler aluminum fittings are in good shape?,var
642,Oil cooler alum fittings  acceptable condition?,var
643,The oil cooler lower outboard bolt has no threads showing.,var
643,No threads visible on the lower O/B bolt of the oil cooler.,var
643,Found the lower outboard bolt on the oil cooler with zero threads exposed.,var
643,Lower oil cooler outboard bolt shows no exposed threads.,var
644,The lower oil cooler line requires rerouting.,var
644,Reroute the oil coolers bottom line  current routing is unacceptable.,var
644,The oil cooler lower hose needs to be re-routed to a different path.,var
644,Requires new routing for the lower line of the oil cooler.,var
645,The front-forward baffle caught on a bolt of the alternator extra bracket.,var
645,    The forward baffle was hung up on the bolt of the alternators auxiliary bracket.,var
645,    Found the front baffle snagged on an alternator extra-bracket bolt.,var
645,    The baffle at the nose/front was trapped on a bolt from the alternators extra bracket.,var
646,"A baffle bolt or screw is missing on the forward left side, just ahead of cylinder #2.",var
646,Found a missing baffle bolt/screw on the forward right side in front of cylinder 3.,var
646,One baffle fastener is absent forward of cylinder 1 on the left-hand side.,var
646,"Forward right-side baffle bolt or screw missing, located immediately forward of cylinder #2.",var
647,The baffle tie wire on the right side of the engine was installed incorrectly.,var
647,Found the baffle tie wire fitted wrong on the left side of the engine.,var
647,Incorrect installation of the baffle tie wire observed at the #2 engine right-hand side.,var
647,The tie wire securing the baffle was put on improperly on the left side of engine #3.,var
648,Nut missing from the engines top rear backbone at the aft sling point.,var
648,The nut has come off the top-back bone of the engine where the aft sling attaches.,var
648,Found no nut on the upper rear backbone of the engine at the aft sling fitting.,var
648,"At the aft sling point on the engines upper rear backbone, the nut is absent.",var
649,Found foreign object damage on the top left side of the engine.,var
649,Inspection revealed FOD at the upper right section of the engine.,var
649,The engines top-left area shows signs of foreign-object impact.,var
649,Noted debris damage on the upper portion of the engine on the right side.,var
650,An extra spark plug was found on top of the No.2 cylinder.,var
650,Saw an extra plug sitting on the top of cylinder #3 during the inspection.,var
650,Found an additional spark plug resting on the upper face of cylinder 1.,var
650,Extra spark plug located on the top of the left #4 cylinder.,var
651,Propeller and engine experienced an overspeed condition.,var
651,"Engine RPM went past limits, causing the prop to overspeed.",var
651,An overspeed event was recorded on the prop/engine  RPM above allowable range.,var
651,Prop overspeed detected; engine exceeded maximum RPM.,var
652,A crack was found in the forward baffle immediately aft of the alternator mount bolt.,var
652,There's a split in the front baffle just behind the alternator mounting bolt.,var
652,Crack located on the forward baffle on the aft side of the alternator mount bolt.,var
652,The forward baffle has a fracture situated aft of the alternator's mount bolt.,var
653,The cowl seal on the front right baffle is loose.,var
653,Found the cowl seal on the front left baffle coming loose during inspection.,var
653,Front-right baffle cowl seal loose; secure or replace as required.,var
653,Cowl seal on the front #2 baffle (left side) is loose and needs attention.,var
654,Crack in the #1 cylinder baffle extends past the stop-drill hole.,var
654,Theres a crack in the #2 cylinder baffle that runs beyond the stop drill.,var
654,Found the cylinder baffle on the right side cracked past the stop-drill.,var
654,Baffle crack on cylinder 3 goes beyond the drilled stop hole.,var
655,A crack was noted on the upper part of the forward right baffle in front of #2.,var
655,Found a crack in the top section of the forward left baffle ahead of #3.,var
655,Observed a crack on the upper forward baffle on the right side just forward of #1.,var
655,Crack identified on the upper portion of the front-left baffle in front of #4.,var
656,The tabs on the baffle plugs are worn off.,var
656,Wear has removed the retention tabs from the baffle plugs.,var
656,Inspection showed the baffle plug tabs are worn away.,var
656,Baffle plugs have lost their tabs due to wear.,var
657,Side baffle seals on engines 3 and 4 are worn.,var
657,The left-side baffle seals on #2 and #3 show wear.,var
657,Worn baffle seals were found on the right side of engines 1 and 4.,var
657,The #4 and #3 side baffle seals are showing wear.,var
658,Baffling above cylinder No. 4 shows a crack.,var
658,Found a crack in the baffle over cylinder #3 during inspection.,var
658,The baffle above the left cylinder #2 is cracked.,var
658,Crack spotted in the baffle over cylinder five.,var
659,The forward baffle seal exhibits localized wear adjacent to the engine induction inlet.,var
659,The front baffle seal has worn spots right next to the engine intake.,var
659,Worn areas were noted on the forward baffle seal by the induction port.,var
659,Forward baffle seal shows abrasion near the engine induction.,var
660,Encountered momentary engine roughness.,var
660,The engine ran rough for a short period.,var
660,Detected a brief episode of rough running on the engine.,var
660,Engine experienced a short-lived roughness.,var
661,Baffle plugs above cylinders 2 and 3 show wear.,var
661,The baffle plugs over #4 and #3 cylinders are worn out.,var
661,Worn baffle plugs were found above cylinders 3 and 4.,var
661,Left baffle plugs above cylinders 2 and 4 exhibit deterioration.,var
662,Left-side baffle requires a baffle plug patch.,var
662,Right baffle needs a baffle plug patch installed.,var
662,Install baffle plug patch on the left baffle  repair required.,var
662,Baffle plug patch required on #2 right-side baffle.,var
663,A screw is missing from the engine baffle at the #3 cylinder next to the oil fill tube.,var
663,Found no screw on the baffle of cylinder #2 by the oil filler tube.,var
663,"The engine baffle on the #4 cylinder, beside the oil-fill tube, has a missing screw.",var
663,Missing screw observed at the baffle near the oil fill tube on cylinder three.,var
664,Left forward baffle material torn; repair required.  ,var
664,Found torn material on the right forward baffle during inspection.  ,var
664,Torn material observed on the #1 forward baffle.  ,var
664,Forward baffle on the left-hand side is ripped and needs replacement.,var
665,Oil is leaking from the middle section of the left engine backbone.,var
665,Found oil seeping out of the center of the right engine backbone.,var
665,Leak detected at the mid-point of the engine backbone on the port side.,var
665,Middle area of the #2 engine backbone shows an oil leak.,var
666,A tywrap on the standoff of cylinder No. 3 was found broken.,var
666,Found the zip tie snapped off the standoff on the No. 1 cylinder.,var
666,Tie-wrap at the standoff on cylinder #4 is broken and requires replacement.,var
666,The zip-tie holding the standoff on cylinder No. 2 failed.,var
667,The battery box bracket was found cracked during inspection.,var
667,A crack was observed in the bracket that secures the battery box.,var
667,The support bracket for the battery box has a fracture and requires attention.,var
667,Found the battery mount bracket splitneeds repair or replacement.,var
668,A simulated oil leak was introduced on the engine for testing.,var
668,We staged an oil leak on the engine to run the drill.,var
668,Simulated engine oil leak detected during the exercise.,var
668,"During the maintenance check, an oil leak was simulated on the engine.",var
669,The oil return line on #3 is chafing against the baffling.,var
669,Found the #1 oil return hose rubbing on the baffle and showing wear.,var
669,Left oil return line exhibits chafing contact with the baffling.,var
669,Oil return line for #4 is chafing on the baffle.,var
670,Thrust buttons on cylinder No. 2 of the left engine show wear.,var
670,Found worn thrust buttons on the #3 cylinder of the right engine.,var
670,"Left engine, cylinder 3  the thrust buttons are worn out.",var
670,Wear observed on the thrust buttons of cylinder No. 4 on the right engine.,var
671,Wiring between #2 and #4 is unsupported.,var
671,The cables from #1 to #3 were found unsecured with no support.,var
671,Unsupported wiring was observed between positions 3 and 4.,var
671,No clamps or supports present on the wire run between No.2 and No.4.,var
672,"The #1 engine exhaust gas temperature (EGT) gauge showed a red X, indicating it is inoperative.",var
672,Found the EGT on engine #3 with a red X  the gauge is dead.,var
672,Exhaust gas temperature for left engine #2 displayed a red X.,var
672,Right engine EGT (engine #4) is showing a red X and not functioning.,var
673,During the run-up the engine failed one time; it ran rough and almost quit.,var
673,    The engine hiccuped on run-up  ran rough and nearly died.,var
673,    Observed a single failure of the engine during run-up; rough operation and nearly a shutdown.,var
673,"    On run-up the engine experienced one failure, was running roughly and almost stopped.",var
674,Two baffle screws are missing from above the starter.,var
674,Found one baffle screw gone on the left side above the starter.,var
674,Three screws that secure the baffle above the starter are absent on the right.,var
674,Missing baffle fasteners above the starter  only one screw remains.,var
675,Right forward baffle material is loose and needs securing.,var
675,The forward baffle skin on the left side was found loose and flapping.,var
675,Found loose material on the front baffle (right) during inspection.,var
675,Front baffle material not secure on the right  requires repair.,var
676,The lock tab on the baffle plug of the right engine is broken.,var
676,Found the baffle plug locking tab cracked on the left engine.,var
676,The #2 engines baffle plug lock tab failed and will need replacement.,var
676,RH engine baffle-plug tab fractured  the lock no longer secures the plug.,var
677,The forward lower engine baffle seal is worn above the engine air intake.,var
677,Inspection found wear on the front lower baffle seal located just above the engine air intake.,var
677,The lower forward baffle seal above the engine air inlet shows noticeable wear and needs attention.,var
677,Wear was observed on the forward lower baffle seal positioned above the engines air intake.,var
678,The aircraft and pilot require start assist.,var
678,Both the airplane and the pilot need help to start the engine.,var
678,A/C needs a start-assist and the pilot also requires assistance to initiate start.,var
678,Start assistance is required for both the pilot and the aircraft.,var
679,Seepage detected at the engine backbone bolts during inspection.,var
679,Oil is seeping around the bolts on the engine backbone.,var
679,The engine backbone bolts are showing signs of leakage.,var
679,There is visible seepage from the bolts on the engine backbone.,var
680,The inter-baffle rod fastener is broken.,var
680,    Found the inter baffle rod fastener snapped during inspection.,var
680,    Fastener securing the inter-baffle rod has failed.,var
680,    The interbaffle rod retaining fastener fractured and needs replacement.,var
681,Inspection found the spring connector between the #1 and #3 cylinder baffles is broken.,var
681,The spring clip holding the #3 and #1 cylinder baffles together has snapped.,var
681,Found a fractured spring connector between the #2 and #4 cylinder baffles.,var
681,Repair item: broken spring connector joining the #1 and #2 cylinder baffles.,var
682,The forward lower cowl seal above the air intake is worn.,var
682,A worn seal was found on the lower front cowling just above the air intake.,var
682,The forward bottom cowl seal over the air inlet shows signs of wear.,var
682,Lower forward cowl seal located above the intake exhibits wear.,var
683,The baffle seal is worn and is rubbing against the surface above the engine inlet.,var
683,Worn baffle seal is contacting and wearing the area above the engine inlet.,var
683,The seal on the baffle is badly worn and is chafing the cowling above the inlet.,var
683,Baffles seal shows excessive wear and is abrading the section above the engine air inlet.,var
684,Rocker drain lines on engines 1 and 3 are leaking.,var
684,Found leaks in the #2 and #4 rocker drain lines.,var
684,Leakage observed from the left and right rocker drain lines.,var
684,The rocker drain hoses for engines 3 and 1 are dripping.,var
685,The forward lower engine baffle seal is being worn by the intake duct.,var
685,The intake is rubbing into the forward lower baffle seal on the engine.,var
685,Observed wear on the forward lower baffle seal where it contacts the intake.,var
685,Forward lower baffle seal for the engine shows abrasion from intake contact.,var
686,Could not get the right engine to start.,var
686,The left engine failed to start on the initial crank.,var
686,Engine #2 would not start despite repeated attempts.,var
686,Start attempt on engine #1 was unsuccessful.,var
687,The engine must be preserved.,var
687,Preserve the engine before it is placed in storage.,var
687,Engine needs preservation  protect it from moisture and corrosion.,var
687,Put the engine into a preserved condition now.,var
688,Baffle tie rod missing under cylinders #2 and #4.,var
688,Can't find the tie rod for the baffle under cyls #3 and #1.,var
688,Left baffle tie rod absent beneath cylinders 2 and 4.,var
688,Right-side tie rod for the baffle was not found under cyls #4 and #2.,var
690,The baffle fastener on cylinders 2 and 4 is broken.,var
690,Found the baffle fastener snapped on cyl #4 and #2.,var
690,Baffle-fastener failure at cyls four & two noted during inspection.,var
690,A broken fastener securing the baffle to cylinders 2/4 was identified.,var
691,"A valve stuck briefly during cruise, causing a slight drop in RPM.",var
691,During cruise flight there was a momentary valve seizure with a small RPM dip.,var
691,Noted a brief sticking valve in cruise that produced a minor decrease in engine rpm.,var
691,"In cruise, the valve stuck for an instant and the RPM fell off slightly.",var
692,Intake on cylinder No. 2 feels loose.,var
692,The intake on the left cylinder 4 was found loose during inspection.,var
692,Found the intake assembly on cylinder 1 to be loose.,var
692,The intake on right cylinder 3 seems loose.,var
693,The right baffling connecting rod is broken.,var
693,Found the left baffling connecting rod snapped during inspection.,var
693,Baffling connecting rod No. 2 on the right side is fractured and needs replacement.,var
693,No. 1 baffle connecting rod on the left-hand side is broken.,var
694,Left inboard (I/B) baffle connecting rod is broken.,var
694,The inboard baffle connecting rod on the right side is snapped.,var
694,Found the connecting rod for the left I/B baffle fractured during inspection.,var
694,Inboard baffle link on the right side has failed and is broken.,var
695,The aft baffle on cylinder #2 is worn.,var
695,Found the rear baffle of cylinder #4 showing wear.,var
695,Worn back baffle observed on cylinder #1.,var
695,Cylinder #3 rearward baffle shows signs of wear.,var
696,"Cylinder No. 1 is leaking oil at the cylinder base, lower aft corner.",var
696,Found oil seeping from the base of the #2 cylinder at the lower rear corner.,var
696,Oil leak observed at the lower aft corner of the base of cylinder number three.,var
696,Lower aft corner of the cylinder base on #4 is leaking oil.,var
697,Duct tape was found on the rear of the oil cooler.,var
697,    Found tape stuck to the back side of the oil cooler during inspection.,var
697,    A temporary patch of duct tape is wrapped around the oil coolers aft face.,var
697,    The oil cooler had duct tape adhered to its backside.,var
698,A wrench was found on a tyrap at the toe of the engine.,var
698,During inspection a spanner was snagged in a zip tie on the engine toe.,var
698,Found a wrench hooked by a tierap on the toe section of the engine.,var
698,A wrench hanging from a tiewrap at the engine toe was discovered.,var
699,Wear on the seal at the forward lower baffle above the intake was observed.,var
699,The seal on the lower-front baffle just above the intake is starting to wear out.,var
699,"Seal deterioration noted at the forward lower baffle, located above the intake.",var
699,Found the seal rubbing through at the lower forward baffle immediately over the intake.,var
700,A screw is missing inboard of the oil cooler that secures the engine baffle.,var
700,Found a missing fastener on the inboard side of the oil cooler for the baffle.,var
700,The inboard screw for the engine baffle at the oil cooler is absent.,var
700,"Missing screw located I/B of the oil cooler, meant to hold the baffle.",var
701,The engine showed intermittent oil pressure readings and was running rough.,var
701,Oil pressure was fluctuating and the engine felt rough during operation.,var
701,Noted unstable oil pressure indications with accompanying engine roughness.,var
701,The unit had varying oil pressure readings and exhibited rough running.,var
702,The #2 cylinder is running very clean.,var
702,Cylinder #4 is operating very clean with minimal carbon build-up.,var
702,Found cylinder number 1 burning extremely clean during the inspection.,var
702,Cylinder #3 shows very clean combustion and almost no deposits.,var
703,The front engine oil seal is leaking.,var
703,Observed oil seepage from the forward engine oil seal during inspection.,var
703,Oil is coming from the engines front seal.,var
703,"Found a leak at the front seal of the engine, oil present.",var
704,Engine requires fogging with preservative oil.,var
704,You need to fog the engine to protect internal parts.,var
704,The engine should be fogged prior to storage.,var
704,Fogging the engine is necessary to prevent corrosion.,var
705,Baffle plug on cylinder #2 is damaged.,var
705,Found the cylinder 4 baffle plug cracked and compromised.,var
705,Damage observed to the baffle plug of cylinder one.,var
705,Inspection showed the #3 cylinders baffle plug is deteriorated.,var
706,The ignition lead standoff on engine #3 is broken.,var
706,Found the ignition lead stand off cracked on the right engine (#2).,var
706,Left engine #4 ignition lead standoff is broken.,var
706,Ignition lead standoff broken on engine 1.,var
707,Intake gaskets on engines #2 and #4 are torn.,var
707,Found a torn intake gasket on engine two and another tear on engine four.,var
707,Torn intake seals were noted on No.4 (left) and No.2 (right).,var
707,Both the #4 and #2 intake gaskets show visible tears.,var
708,Rivets on the #3 aft baffle bracket have pulled through the bracket.  ,var
708,On the #2 rear baffle bracket the rivets have worked loose and pulled thru the bracket material.  ,var
708,Found rivets pulled through the aft baffle bracket on engine #4.  ,var
708,The #1 aft baffle bracket shows rivets that have completely pulled through the bracket.,var
709,Intake tubes on cylinders #2 and #4 are leaking at the flexible tube connections.  ,var
709,Found leaks at the flexible intake joint on cyl 3 and 4.  ,var
709,Left-side intake flexible connection leaking on cylinders 1 and 3.  ,var
709,Leak detected at the flexible tube connection of the intake tubes for cylinder 4 and 2.,var
710,Cracks were found in the forward right baffle.,var
710,Inspection revealed cracking in the forward left baffle.,var
710,The forward right-side baffle shows multiple cracks.,var
710,Cracks observed in the forward baffle at station #1 on the left side.,var
711,The forward baffle seal on cylinder No. 2 exhibits a worn-through hole.,var
711,There's a hole worn in the forward baffle seal of cylinder 1.,var
711,Found a worn hole in the forward baffle seal of cylinder No. 3.,var
711,Cylinder 4 forward baffle seal has a worn hole.,var
712,During run-up both magnetos dropped more than 300 rpm and the engine shook violently.,var
712,At run-up the left mag fell about 350 rpm and caused aggressive vibration.,var
712,On the run-up the right magneto lost roughly 250 rpm with heavy shaking.,var
712,"During the engine run-up a mag drop of 300+ rpm was observed, accompanied by severe shaking.",var
713,The black seal on the forward lower baffle is worn at the intake.,var
713,    Found wear on the forward lower baffles black intake seal from rubbing against the intake.,var
713,    Forward lower baffle black seal shows abrasion from the intake area.,var
713,    Wear observed on the intake side of the lower forward baffles black seal.,var
714,One screw was found loose on the baffle behind the oil dipstick tube.,var
714,Theres a loose screw holding the baffle located behind the oil dipstick tube.,var
714,Loose fastener noted at the baffle aft of the oil dipstick tube  single screw affected.,var
714,Two screws were loose on the baffle behind the oil dipstick tube.,var
715,The right baffle plug is loose.,var
715,Found the left baffle plug loose during inspection.,var
715,No. 2 baffle plug observed loose; secure it.,var
715,Baffle plug on the #1 side is loose.,var
716,Harness anchor studs on cylinders 2 and 4 are broken.,var
716,I found the cylinder harness anchors on #1 and #3 snapped off during inspection.,var
716,The anchor points for the cylinder harnesses (cylinders 4 and 2) have failed.,var
716,Cylinder harness anchors at #3 and #1 are fractured and need replacement.,var
717,Lueco markings are required.,var
717,Please apply LUECO identification markings.,var
717,Need to have Lueco labels installed.,var
717,LUECO marking must be present.,var
718,Engine quit at idle  low RPM while taxiing after small throttle adjustments.,var
718,"    While taxiing, the engine died at low idle following minor adjustments.",var
718,    The engine shut down at idle/low RPM during taxi when small tweaks were made.,var
718,"    During taxi, small control changes caused the engine to lose power and quit at idle.",var
719,Left engine #4 cylinder has no compression.,var
719,No compression found in cylinder 3 of the right engine.,var
719,Cylinder 2 on the left engine registers zero compression.,var
719,Right engines No.4 cylinder isnt holding compression.,var
720,No. 4 intake outboard bolt lock-washer is installed in the wrong position.  ,var
720,Found the outboard lock washer on the No. 3 intake sitting in the wrong spot.  ,var
720,Lock washer for the intake O/B bolt on #5 was discovered mispositioned.  ,var
720,Left intake outboard bolt lock washer fitted incorrectly.,var
721,A screw is missing from the #2 outer cylinder baffling.,var
721,    Noticed the outer cylinder baffling on #1 has a missing screw.,var
721,    Missing fastener on the outer baffling of the #3 cylinder.,var
721,    Outer cylinder baffling on #4 is lacking a screw.,var
722,The aft crankcase spin bolt is missing its nut.,var
722,Found the nut missing from the spin bolt at the rear of the crankcase.,var
722,Nut absent on the aft crankcase spin-bolt assembly.,var
722,The spin bolt at the back of the crankcase had no nut installed.,var
723,"With the throttle set to idle, the engine exhibited rough running.",var
723,"    When idling, the engine ran rough.",var
723,    Engine ran rough at idle throttle.,var
723,    Rough engine operation was observed with the throttle at idle.,var
724,Top of engine crankcase is leaking oil through the two middle thro.,var
724,Oil is coming out of the upper crankcase via the middle two thro openings.,var
724,Upper engine crankcase shows an oil leak at the center one thro.,var
724,There is oil seeping from the top of the crankcase through the three central thro points.,var
725,Baffle #4 on the right engine was found with loose hardware.,var
725,"Found loose fasteners on the left engine baffle, listed as #3.",var
725,Loose hardware was noted on baffle #2 of the right-side engine.,var
725,Right engine baffle shows loose screws at station 4.,var
726,A doubler is required at the inspection hole in the No. 4 cylinder baffle.,var
726,Install a doubler over the insp hole on the No. 3 cylinder baffle  its needed.,var
726,Inspection-hole doubler required for the baffle on cylinder No. 2.,var
726,The baffle inspection opening of cylinder 1 needs a reinforcement doubler.,var
727,Chafing found on the left engine bleed-air line during inspection.,var
727,The right engine bleed air hose is rubbing and showing wear.,var
727,Bleed-air line on engine 1 exhibits chafed insulation.,var
727,Chafed bleed air tubing discovered on engine 2 at the clamp point.,var
728,Left aft cowl inboard access panel screw is stripped.,var
728,The inboard access screw on the right aft cowl was found rounded off.,var
728,Found a stripped screw in the aft I/B access panel of the left cowl.,var
728,Right aft cowl I/B access-panel screw damaged (stripped).,var
729,Left engine reported smoking after shutdown.,var
729,"After shutdown, the #1 engine was observed emitting smoke.",var
729,Right-hand engine was reported to be smoking once it was shut down.,var
729,Crew reported smoke from engine 2 following shutdown.,var
730,The right engine exhibited roughness during taxi operations.,var
730,"During taxi, the left engine was running rough.",var
730,Engine #2 was rough while taxiing.,var
